2010-10-23 09:28:24.275449 IP 10.214.187.15.40422 > 10.217.31.171.3306: tcp 0
2010-10-23 09:28:24.275935 IP 10.214.187.15.40422 > 10.217.31.171.3306: tcp 101
2010-10-23 09:28:24.276131 IP 10.217.31.171.3306 > 10.214.187.15.40422: tcp 885
2010-10-23 09:28:24.276329 IP 10.217.31.171.3306 > 10.246.19.127.60912: tcp 713
2010-10-23 09:28:24.276732 IP 10.192.74.63.33649 > 10.217.31.171.3306: tcp 111
2010-10-23 09:28:24.276952 IP 10.217.31.171.3306 > 10.192.74.63.33649: tcp 535
2010-10-23 09:28:24.277007 IP 10.214.187.15.40422 > 10.217.31.171.3306: tcp 63
2010-10-23 09:28:24.277096 IP 10.194.226.159.35270 > 10.217.31.171.3306: tcp 75
2010-10-23 09:28:24.277147 IP 10.217.31.171.3306 > 10.214.187.15.40422: tcp 2896
2010-10-23 09:28:24.277156 IP 10.217.31.171.3306 > 10.214.187.15.40422: tcp 795
2010-10-23 09:28:24.277190 IP 10.217.31.171.3306 > 10.194.226.159.35270: tcp 716
2010-10-23 09:28:24.277547 IP 10.214.187.15.40422 > 10.217.31.171.3306: tcp 0
2010-10-23 09:28:24.278005 IP 10.214.187.15.40422 > 10.217.31.171.3306: tcp 110
2010-10-23 09:28:24.278150 IP 10.217.31.171.3306 > 10.214.187.15.40422: tcp 64
2010-10-23 09:28:24.278815 IP 10.214.187.15.40422 > 10.217.31.171.3306: tcp 90
2010-10-23 09:28:24.278935 IP 10.217.31.171.3306 > 10.214.187.15.40422: tcp 852
2010-10-23 09:28:24.279319 IP 10.194.226.159.35270 > 10.217.31.171.3306: tcp 171
2010-10-23 09:28:24.279495 IP 10.217.31.171.3306 > 10.194.226.159.35270: tcp 2896
2010-10-23 09:28:24.279503 IP 10.217.31.171.3306 > 10.194.226.159.35270: tcp 4344
2010-10-23 09:28:24.279506 IP 10.217.31.171.3306 > 10.194.226.159.35270: tcp 566
2010-10-23 09:28:24.279735 IP 10.214.187.15.40422 > 10.217.31.171.3306: tcp 83
2010-10-23 09:28:24.279783 IP 10.246.19.127.60912 > 10.217.31.171.3306: tcp 171
2010-10-23 09:28:24.279840 IP 10.217.31.171.3306 > 10.214.187.15.40422: tcp 64
2010-10-23 09:28:24.279917 IP 10.217.31.171.3306 > 10.246.19.127.60912: tcp 1448
2010-10-23 09:28:24.279923 IP 10.217.31.171.3306 > 10.246.19.127.60912: tcp 7
2010-10-23 09:28:24.280547 IP 10.214.187.15.40422 > 10.217.31.171.3306: tcp 102
2010-10-23 09:28:24.280680 IP 10.217.31.171.3306 > 10.214.187.15.40422: tcp 64
2010-10-23 09:28:24.281181 IP 10.194.226.159.35270 > 10.217.31.171.3306: tcp 0
2010-10-23 09:28:24.281228 IP 10.194.226.159.35270 > 10.217.31.171.3306: tcp 0
2010-10-23 09:28:24.281273 IP 10.246.19.127.60912 > 10.217.31.171.3306: tcp 0
2010-10-23 09:28:24.281323 IP 10.214.187.15.40422 > 10.217.31.171.3306: tcp 82
2010-10-23 09:28:24.281405 IP 10.194.226.159.35270 > 10.217.31.171.3306: tcp 0
2010-10-23 09:28:24.281488 IP 10.217.31.171.3306 > 10.214.187.15.40422: tcp 1448
2010-10-23 09:28:24.281498 IP 10.217.31.171.3306 > 10.214.187.15.40422: tcp 1395
2010-10-23 09:28:24.281652 IP 10.194.226.159.35270 > 10.217.31.171.3306: tcp 177
2010-10-23 09:28:24.281883 IP 10.214.187.15.40422 > 10.217.31.171.3306: tcp 0
2010-10-23 09:28:24.282402 IP 10.214.187.15.40422 > 10.217.31.171.3306: tcp 83
2010-10-23 09:28:24.282501 IP 10.217.31.171.3306 > 10.214.187.15.40422: tcp 64
2010-10-23 09:28:24.282552 IP 10.217.31.171.3306 > 10.194.226.159.35270: tcp 2896
2010-10-23 09:28:24.282560 IP 10.217.31.171.3306 > 10.194.226.159.35270: tcp 4344
2010-10-23 09:28:24.282565 IP 10.217.31.171.3306 > 10.194.226.159.35270: tcp 4344
2010-10-23 09:28:24.282567 IP 10.217.31.171.3306 > 10.194.226.159.35270: tcp 429
2010-10-23 09:28:24.283230 IP 10.214.187.15.40422 > 10.217.31.171.3306: tcp 102
2010-10-23 09:28:24.283348 IP 10.217.31.171.3306 > 10.214.187.15.40422: tcp 64
2010-10-23 09:28:24.284082 IP 10.214.187.15.40422 > 10.217.31.171.3306: tcp 82
2010-10-23 09:28:24.284241 IP 10.217.31.171.3306 > 10.214.187.15.40422: tcp 1448
2010-10-23 09:28:24.284251 IP 10.217.31.171.3306 > 10.214.187.15.40422: tcp 1397
2010-10-23 09:28:24.284319 IP 10.194.226.159.35270 > 10.217.31.171.3306: tcp 0
2010-10-23 09:28:24.284325 IP 10.194.226.159.35270 > 10.217.31.171.3306: tcp 0
2010-10-23 09:28:24.284686 IP 10.214.187.15.40422 > 10.217.31.171.3306: tcp 0
2010-10-23 09:28:24.284976 IP 10.194.226.159.35270 > 10.217.31.171.3306: tcp 0
2010-10-23 09:28:24.285081 IP 10.194.226.159.35270 > 10.217.31.171.3306: tcp 0
2010-10-23 09:28:24.285212 IP 10.214.187.15.40422 > 10.217.31.171.3306: tcp 83
2010-10-23 09:28:24.285303 IP 10.217.31.171.3306 > 10.214.187.15.40422: tcp 64
2010-10-23 09:28:24.286011 IP 10.214.187.15.40422 > 10.217.31.171.3306: tcp 102
2010-10-23 09:28:24.286126 IP 10.217.31.171.3306 > 10.214.187.15.40422: tcp 64
2010-10-23 09:28:24.286631 IP 10.246.19.127.60912 > 10.217.31.171.3306: tcp 121
2010-10-23 09:28:24.286756 IP 10.217.31.171.3306 > 10.246.19.127.60912: tcp 1358
2010-10-23 09:28:24.286788 IP 10.214.187.15.40422 > 10.217.31.171.3306: tcp 82
2010-10-23 09:28:24.286948 IP 10.217.31.171.3306 > 10.214.187.15.40422: tcp 1448
2010-10-23 09:28:24.286959 IP 10.217.31.171.3306 > 10.214.187.15.40422: tcp 1396
2010-10-23 09:28:24.287386 IP 10.214.187.15.40422 > 10.217.31.171.3306: tcp 0
2010-10-23 09:28:24.287582 IP 10.194.226.159.35270 > 10.217.31.171.3306: tcp 177
2010-10-23 09:28:24.287942 IP 10.214.187.15.40422 > 10.217.31.171.3306: tcp 101
2010-10-23 09:28:24.288028 IP 10.217.31.171.3306 > 10.214.187.15.40422: tcp 889
2010-10-23 09:28:24.288414 IP 10.217.31.171.3306 > 10.194.226.159.35270: tcp 2896
2010-10-23 09:28:24.288422 IP 10.217.31.171.3306 > 10.194.226.159.35270: tcp 4344
2010-10-23 09:28:24.288426 IP 10.217.31.171.3306 > 10.194.226.159.35270: tcp 4344
2010-10-23 09:28:24.288428 IP 10.217.31.171.3306 > 10.194.226.159.35270: tcp 429
2010-10-23 09:28:24.288861 IP 10.214.187.15.40422 > 10.217.31.171.3306: tcp 63
2010-10-23 09:28:24.288987 IP 10.217.31.171.3306 > 10.214.187.15.40422: tcp 1448
2010-10-23 09:28:24.289000 IP 10.217.31.171.3306 > 10.214.187.15.40422: tcp 1448
2010-10-23 09:28:24.289005 IP 10.217.31.171.3306 > 10.214.187.15.40422: tcp 644
2010-10-23 09:28:24.289438 IP 10.214.187.15.40422 > 10.217.31.171.3306: tcp 0
2010-10-23 09:28:24.289446 IP 10.246.19.127.60912 > 10.217.31.171.3306: tcp 171
2010-10-23 09:28:24.289576 IP 10.217.31.171.3306 > 10.246.19.127.60912: tcp 1448
2010-10-23 09:28:24.289582 IP 10.217.31.171.3306 > 10.246.19.127.60912: tcp 7
2010-10-23 09:28:24.290123 IP 10.194.226.159.35270 > 10.217.31.171.3306: tcp 0
2010-10-23 09:28:24.290166 IP 10.194.226.159.35270 > 10.217.31.171.3306: tcp 0
2010-10-23 09:28:24.290323 IP 10.214.187.15.40422 > 10.217.31.171.3306: tcp 110
2010-10-23 09:28:24.290438 IP 10.217.31.171.3306 > 10.214.187.15.40422: tcp 64
2010-10-23 09:28:24.290626 IP 10.194.226.159.35270 > 10.217.31.171.3306: tcp 0
2010-10-23 09:28:24.290678 IP 10.194.226.159.35270 > 10.217.31.171.3306: tcp 0
2010-10-23 09:28:24.290682 IP 10.246.19.127.60912 > 10.217.31.171.3306: tcp 0
2010-10-23 09:28:24.290842 IP 10.194.226.159.35270 > 10.217.31.171.3306: tcp 177
2010-10-23 09:28:24.291139 IP 10.214.187.15.40422 > 10.217.31.171.3306: tcp 90
2010-10-23 09:28:24.291262 IP 10.217.31.171.3306 > 10.214.187.15.40422: tcp 841
2010-10-23 09:28:24.291671 IP 10.217.31.171.3306 > 10.194.226.159.35270: tcp 4344
2010-10-23 09:28:24.291678 IP 10.217.31.171.3306 > 10.194.226.159.35270: tcp 2896
2010-10-23 09:28:24.291682 IP 10.217.31.171.3306 > 10.194.226.159.35270: tcp 4344
2010-10-23 09:28:24.291684 IP 10.217.31.171.3306 > 10.194.226.159.35270: tcp 429
2010-10-23 09:28:24.291854 IP 10.202.230.193.41976 > 10.217.31.171.3306: tcp 0
2010-10-23 09:28:24.291983 IP 10.214.187.15.40422 > 10.217.31.171.3306: tcp 83
2010-10-23 09:28:24.292081 IP 10.217.31.171.3306 > 10.214.187.15.40422: tcp 64
2010-10-23 09:28:24.292605 IP 10.246.19.127.60912 > 10.217.31.171.3306: tcp 160
2010-10-23 09:28:24.292732 IP 10.217.31.171.3306 > 10.246.19.127.60912: tcp 1432
2010-10-23 09:28:24.292839 IP 10.214.187.15.40422 > 10.217.31.171.3306: tcp 102
2010-10-23 09:28:24.292964 IP 10.217.31.171.3306 > 10.214.187.15.40422: tcp 64
2010-10-23 09:28:24.293352 IP 10.194.226.159.35270 > 10.217.31.171.3306: tcp 0
2010-10-23 09:28:24.293418 IP 10.194.226.159.35270 > 10.217.31.171.3306: tcp 0
2010-10-23 09:28:24.293604 IP 10.214.187.15.40422 > 10.217.31.171.3306: tcp 82
2010-10-23 09:28:24.293747 IP 10.194.226.159.35270 > 10.217.31.171.3306: tcp 0
2010-10-23 09:28:24.293764 IP 10.217.31.171.3306 > 10.214.187.15.40422: tcp 1448
2010-10-23 09:28:24.293775 IP 10.217.31.171.3306 > 10.214.187.15.40422: tcp 1395
2010-10-23 09:28:24.293796 IP 10.194.226.159.35270 > 10.217.31.171.3306: tcp 0
2010-10-23 09:28:24.293960 IP 10.194.226.159.35270 > 10.217.31.171.3306: tcp 112
2010-10-23 09:28:24.294127 IP 10.217.31.171.3306 > 10.194.226.159.35270: tcp 78
2010-10-23 09:28:24.294158 IP 10.214.187.15.40422 > 10.217.31.171.3306: tcp 0
2010-10-23 09:28:24.294724 IP 10.214.187.15.40422 > 10.217.31.171.3306: tcp 83
2010-10-23 09:28:24.294817 IP 10.217.31.171.3306 > 10.214.187.15.40422: tcp 64
2010-10-23 09:28:24.295532 IP 10.214.187.15.40422 > 10.217.31.171.3306: tcp 102
2010-10-23 09:28:24.295649 IP 10.217.31.171.3306 > 10.214.187.15.40422: tcp 64
2010-10-23 09:28:24.296313 IP 10.214.187.15.40422 > 10.217.31.171.3306: tcp 82
2010-10-23 09:28:24.296471 IP 10.217.31.171.3306 > 10.214.187.15.40422: tcp 1448
2010-10-23 09:28:24.296481 IP 10.217.31.171.3306 > 10.214.187.15.40422: tcp 1394
2010-10-23 09:28:24.297674 IP 10.198.15.239.48454 > 10.217.31.171.3306: tcp 5
2010-10-23 09:28:24.297862 IP 10.217.31.171.3306 > 10.198.15.239.48454: tcp 162
2010-10-23 09:28:24.298140 IP 10.246.19.127.60912 > 10.217.31.171.3306: tcp 159
2010-10-23 09:28:24.298211 IP 10.214.187.15.40422 > 10.217.31.171.3306: tcp 0
2010-10-23 09:28:24.298256 IP 10.198.15.239.48454 > 10.217.31.171.3306: tcp 0
2010-10-23 09:28:24.298299 IP 10.217.31.171.3306 > 10.246.19.127.60912: tcp 1429
2010-10-23 09:28:24.298751 IP 10.214.187.15.40422 > 10.217.31.171.3306: tcp 83
2010-10-23 09:28:24.298847 IP 10.217.31.171.3306 > 10.214.187.15.40422: tcp 64
2010-10-23 09:28:24.299568 IP 10.214.187.15.40422 > 10.217.31.171.3306: tcp 102
2010-10-23 09:28:24.299684 IP 10.217.31.171.3306 > 10.214.187.15.40422: tcp 64
2010-10-23 09:28:24.300328 IP 10.214.187.15.40422 > 10.217.31.171.3306: tcp 82
2010-10-23 09:28:24.300491 IP 10.217.31.171.3306 > 10.214.187.15.40422: tcp 1448
2010-10-23 09:28:24.300501 IP 10.217.31.171.3306 > 10.214.187.15.40422: tcp 1395
2010-10-23 09:28:24.301272 IP 10.250.106.79.57880 > 10.217.31.171.3306: tcp 5
2010-10-23 09:28:24.301431 IP 10.217.31.171.3306 > 10.250.106.79.57880: tcp 162
2010-10-23 09:28:24.301452 IP 10.222.102.143.58425 > 10.217.31.171.3306: tcp 120
2010-10-23 09:28:24.301630 IP 10.217.31.171.3306 > 10.222.102.143.58425: tcp 1448
2010-10-23 09:28:24.301637 IP 10.217.31.171.3306 > 10.222.102.143.58425: tcp 1370
2010-10-23 09:28:24.301808 IP 10.214.187.15.40422 > 10.217.31.171.3306: tcp 0
2010-10-23 09:28:24.301990 IP 10.246.19.127.60912 > 10.217.31.171.3306: tcp 159
2010-10-23 09:28:24.302113 IP 10.217.31.171.3306 > 10.246.19.127.60912: tcp 1429
2010-10-23 09:28:24.302282 IP 10.250.106.79.57880 > 10.217.31.171.3306: tcp 0
2010-10-23 09:28:24.302327 IP 10.214.187.15.40422 > 10.217.31.171.3306: tcp 101
2010-10-23 09:28:24.302414 IP 10.217.31.171.3306 > 10.214.187.15.40422: tcp 885
2010-10-23 09:28:24.302612 IP 10.222.102.143.58425 > 10.217.31.171.3306: tcp 0
2010-10-23 09:28:24.303067 IP 10.222.102.143.58425 > 10.217.31.171.3306: tcp 0
2010-10-23 09:28:24.303238 IP 10.214.187.15.40422 > 10.217.31.171.3306: tcp 63
2010-10-23 09:28:24.303360 IP 10.217.31.171.3306 > 10.214.187.15.40422: tcp 2896
2010-10-23 09:28:24.303370 IP 10.217.31.171.3306 > 10.214.187.15.40422: tcp 966
2010-10-23 09:28:24.303763 IP 10.214.187.15.40422 > 10.217.31.171.3306: tcp 0
2010-10-23 09:28:24.304628 IP 10.194.226.159.35270 > 10.217.31.171.3306: tcp 177
2010-10-23 09:28:24.305035 IP 10.214.187.15.40422 > 10.217.31.171.3306: tcp 110
2010-10-23 09:28:24.305150 IP 10.217.31.171.3306 > 10.214.187.15.40422: tcp 64
2010-10-23 09:28:24.305459 IP 10.217.31.171.3306 > 10.194.226.159.35270: tcp 4344
2010-10-23 09:28:24.305467 IP 10.217.31.171.3306 > 10.194.226.159.35270: tcp 2896
2010-10-23 09:28:24.305472 IP 10.217.31.171.3306 > 10.194.226.159.35270: tcp 4344
2010-10-23 09:28:24.305473 IP 10.217.31.171.3306 > 10.194.226.159.35270: tcp 429
2010-10-23 09:28:24.305786 IP 10.214.187.15.40422 > 10.217.31.171.3306: tcp 90
2010-10-23 09:28:24.305907 IP 10.217.31.171.3306 > 10.214.187.15.40422: tcp 790
2010-10-23 09:28:24.306074 IP 10.246.19.127.60912 > 10.217.31.171.3306: tcp 163
2010-10-23 09:28:24.306225 IP 10.217.31.171.3306 > 10.246.19.127.60912: tcp 64
2010-10-23 09:28:24.306676 IP 10.214.187.15.40422 > 10.217.31.171.3306: tcp 83
2010-10-23 09:28:24.306776 IP 10.217.31.171.3306 > 10.214.187.15.40422: tcp 64
2010-10-23 09:28:24.306844 IP 10.223.43.239.58959 > 10.217.31.171.3306: tcp 5
2010-10-23 09:28:24.307008 IP 10.217.31.171.3306 > 10.223.43.239.58959: tcp 162
2010-10-23 09:28:24.307152 IP 10.243.79.191.43655 > 10.217.31.171.3306: tcp 0
2010-10-23 09:28:24.307206 IP 10.194.226.159.35270 > 10.217.31.171.3306: tcp 0
2010-10-23 09:28:24.307210 IP 10.194.226.159.35270 > 10.217.31.171.3306: tcp 0
2010-10-23 09:28:24.307332 IP 10.250.106.79.57880 > 10.217.31.171.3306: tcp 67
2010-10-23 09:28:24.307439 IP 10.198.15.239.48454 > 10.217.31.171.3306: tcp 109
2010-10-23 09:28:24.307510 IP 10.214.187.15.40422 > 10.217.31.171.3306: tcp 102
2010-10-23 09:28:24.307542 IP 10.217.31.171.3306 > 10.250.106.79.57880: tcp 4344
2010-10-23 09:28:24.307549 IP 10.217.31.171.3306 > 10.250.106.79.57880: tcp 1448
2010-10-23 09:28:24.307558 IP 10.194.226.159.35270 > 10.217.31.171.3306: tcp 0
2010-10-23 09:28:24.307610 IP 10.194.226.159.35270 > 10.217.31.171.3306: tcp 0
2010-10-23 09:28:24.307678 IP 10.217.31.171.3306 > 10.214.187.15.40422: tcp 64
2010-10-23 09:28:24.307693 IP 10.217.31.171.3306 > 10.198.15.239.48454: tcp 1207
2010-10-23 09:28:24.307789 IP 10.194.226.159.35270 > 10.217.31.171.3306: tcp 177
2010-10-23 09:28:24.308047 IP 10.223.43.239.58959 > 10.217.31.171.3306: tcp 0
2010-10-23 09:28:24.308328 IP 10.214.187.15.40422 > 10.217.31.171.3306: tcp 82
2010-10-23 09:28:24.308500 IP 10.217.31.171.3306 > 10.214.187.15.40422: tcp 1448
2010-10-23 09:28:24.308507 IP 10.217.31.171.3306 > 10.214.187.15.40422: tcp 1396
2010-10-23 09:28:24.308613 IP 10.246.19.127.60912 > 10.217.31.171.3306: tcp 68
2010-10-23 09:28:24.308659 IP 10.217.31.171.3306 > 10.194.226.159.35270: tcp 4344
2010-10-23 09:28:24.308669 IP 10.250.106.79.57880 > 10.217.31.171.3306: tcp 0
2010-10-23 09:28:24.308673 IP 10.250.106.79.57880 > 10.217.31.171.3306: tcp 0
2010-10-23 09:28:24.308678 IP 10.217.31.171.3306 > 10.194.226.159.35270: tcp 4344
2010-10-23 09:28:24.308683 IP 10.217.31.171.3306 > 10.194.226.159.35270: tcp 2896
2010-10-23 09:28:24.308685 IP 10.217.31.171.3306 > 10.194.226.159.35270: tcp 429
2010-10-23 09:28:24.308896 IP 10.217.31.171.3306 > 10.246.19.127.60912: tcp 1448
2010-10-23 09:28:24.308901 IP 10.217.31.171.3306 > 10.246.19.127.60912: tcp 1379
2010-10-23 09:28:24.308916 IP 10.217.31.171.3306 > 10.250.106.79.57880: tcp 1326
2010-10-23 09:28:24.308930 IP 10.214.187.15.40422 > 10.217.31.171.3306: tcp 0
2010-10-23 09:28:24.309475 IP 10.214.187.15.40422 > 10.217.31.171.3306: tcp 83
2010-10-23 09:28:24.309572 IP 10.217.31.171.3306 > 10.214.187.15.40422: tcp 64
2010-10-23 09:28:24.310000 IP 10.246.19.127.60912 > 10.217.31.171.3306: tcp 0
2010-10-23 09:28:24.310298 IP 10.214.187.15.40422 > 10.217.31.171.3306: tcp 102
2010-10-23 09:28:24.310410 IP 10.194.226.159.35270 > 10.217.31.171.3306: tcp 0
2010-10-23 09:28:24.310418 IP 10.217.31.171.3306 > 10.214.187.15.40422: tcp 64
2010-10-23 09:28:24.310464 IP 10.194.226.159.35270 > 10.217.31.171.3306: tcp 0
2010-10-23 09:28:24.310468 IP 10.194.226.159.35270 > 10.217.31.171.3306: tcp 0
2010-10-23 09:28:24.310559 IP 10.194.226.159.35270 > 10.217.31.171.3306: tcp 0
2010-10-23 09:28:24.311007 IP 10.194.226.159.35270 > 10.217.31.171.3306: tcp 65
2010-10-23 09:28:24.311054 IP 10.214.187.15.40422 > 10.217.31.171.3306: tcp 82
2010-10-23 09:28:24.311167 IP 10.217.31.171.3306 > 10.194.226.159.35270: tcp 4344
2010-10-23 09:28:24.311173 IP 10.217.31.171.3306 > 10.194.226.159.35270: tcp 249
2010-10-23 09:28:24.311239 IP 10.217.31.171.3306 > 10.214.187.15.40422: tcp 1448
2010-10-23 09:28:24.311249 IP 10.217.31.171.3306 > 10.214.187.15.40422: tcp 1395
2010-10-23 09:28:24.311536 IP 10.223.43.239.58959 > 10.217.31.171.3306: tcp 86
2010-10-23 09:28:24.311698 IP 10.214.187.15.40422 > 10.217.31.171.3306: tcp 0
2010-10-23 09:28:24.311729 IP 10.217.31.171.3306 > 10.223.43.239.58959: tcp 2896
2010-10-23 09:28:24.311735 IP 10.217.31.171.3306 > 10.223.43.239.58959: tcp 1448
2010-10-23 09:28:24.311884 IP 10.250.106.79.57880 > 10.217.31.171.3306: tcp 86
2010-10-23 09:28:24.312048 IP 10.217.31.171.3306 > 10.250.106.79.57880: tcp 1448
2010-10-23 09:28:24.312055 IP 10.217.31.171.3306 > 10.250.106.79.57880: tcp 4344
2010-10-23 09:28:24.312059 IP 10.217.31.171.3306 > 10.250.106.79.57880: tcp 1448
2010-10-23 09:28:24.312216 IP 10.214.187.15.40422 > 10.217.31.171.3306: tcp 101
2010-10-23 09:28:24.312310 IP 10.217.31.171.3306 > 10.214.187.15.40422: tcp 889
2010-10-23 09:28:24.312823 IP 10.223.43.239.58959 > 10.217.31.171.3306: tcp 0
2010-10-23 09:28:24.312828 IP 10.194.226.159.35270 > 10.217.31.171.3306: tcp 0
2010-10-23 09:28:24.312839 IP 10.217.31.171.3306 > 10.223.43.239.58959: tcp 4344
2010-10-23 09:28:24.312887 IP 10.194.226.159.35270 > 10.217.31.171.3306: tcp 0
2010-10-23 09:28:24.313065 IP 10.250.106.79.57880 > 10.217.31.171.3306: tcp 0
2010-10-23 09:28:24.313076 IP 10.217.31.171.3306 > 10.250.106.79.57880: tcp 1448
2010-10-23 09:28:24.313080 IP 10.217.31.171.3306 > 10.250.106.79.57880: tcp 161
2010-10-23 09:28:24.313115 IP 10.250.106.79.57880 > 10.217.31.171.3306: tcp 0
2010-10-23 09:28:24.313163 IP 10.214.187.15.40422 > 10.217.31.171.3306: tcp 63
2010-10-23 09:28:24.313288 IP 10.217.31.171.3306 > 10.214.187.15.40422: tcp 2896
2010-10-23 09:28:24.313298 IP 10.217.31.171.3306 > 10.214.187.15.40422: tcp 757
2010-10-23 09:28:24.313307 IP 10.246.19.127.60912 > 10.217.31.171.3306: tcp 158
2010-10-23 09:28:24.313682 IP 10.214.187.15.40422 > 10.217.31.171.3306: tcp 0
2010-10-23 09:28:24.313958 IP 10.223.43.239.58959 > 10.217.31.171.3306: tcp 0
2010-10-23 09:28:24.313963 IP 10.223.43.239.58959 > 10.217.31.171.3306: tcp 0
2010-10-23 09:28:24.313998 IP 10.250.106.79.57880 > 10.217.31.171.3306: tcp 0
2010-10-23 09:28:24.314132 IP 10.214.187.15.40422 > 10.217.31.171.3306: tcp 110
2010-10-23 09:28:24.314273 IP 10.217.31.171.3306 > 10.214.187.15.40422: tcp 64
2010-10-23 09:28:24.314964 IP 10.214.187.15.40422 > 10.217.31.171.3306: tcp 90
2010-10-23 09:28:24.315081 IP 10.217.31.171.3306 > 10.214.187.15.40422: tcp 783
2010-10-23 09:28:24.315585 IP 10.243.139.111.45401 > 10.217.31.171.3306: tcp 5
2010-10-23 09:28:24.315645 IP 10.194.226.159.35270 > 10.217.31.171.3306: tcp 177
2010-10-23 09:28:24.315709 IP 10.250.106.79.57880 > 10.217.31.171.3306: tcp 105
2010-10-23 09:28:24.315831 IP 10.214.187.15.40422 > 10.217.31.171.3306: tcp 83
2010-10-23 09:28:24.315927 IP 10.217.31.171.3306 > 10.214.187.15.40422: tcp 64
2010-10-23 09:28:24.316632 IP 10.214.187.15.40422 > 10.217.31.171.3306: tcp 102
2010-10-23 09:28:24.316756 IP 10.217.31.171.3306 > 10.214.187.15.40422: tcp 64
2010-10-23 09:28:24.317404 IP 10.214.187.15.40422 > 10.217.31.171.3306: tcp 82
2010-10-23 09:28:24.317471 IP 10.217.31.171.3306 > 10.246.19.127.60912: tcp 1448
2010-10-23 09:28:24.317478 IP 10.217.31.171.3306 > 10.246.19.127.60912: tcp 961
2010-10-23 09:28:24.317499 IP 10.217.31.171.3306 > 10.223.43.239.58959: tcp 93
2010-10-23 09:28:24.317605 IP 10.217.31.171.3306 > 10.214.187.15.40422: tcp 1448
2010-10-23 09:28:24.317612 IP 10.217.31.171.3306 > 10.214.187.15.40422: tcp 1400
2010-10-23 09:28:24.317925 IP 10.217.31.171.3306 > 10.194.226.159.35270: tcp 4344
2010-10-23 09:28:24.317933 IP 10.217.31.171.3306 > 10.194.226.159.35270: tcp 4344
2010-10-23 09:28:24.317937 IP 10.217.31.171.3306 > 10.194.226.159.35270: tcp 2896
2010-10-23 09:28:24.317940 IP 10.217.31.171.3306 > 10.194.226.159.35270: tcp 429
2010-10-23 09:28:24.317977 IP 10.214.187.15.40422 > 10.217.31.171.3306: tcp 0
2010-10-23 09:28:24.318060 IP 10.217.31.171.3306 > 10.243.139.111.45401: tcp 162
2010-10-23 09:28:24.318515 IP 10.246.19.127.60912 > 10.217.31.171.3306: tcp 0
2010-10-23 09:28:24.318521 IP 10.214.187.15.40422 > 10.217.31.171.3306: tcp 83
2010-10-23 09:28:24.318620 IP 10.217.31.171.3306 > 10.214.187.15.40422: tcp 64
2010-10-23 09:28:24.319320 IP 10.214.187.15.40422 > 10.217.31.171.3306: tcp 102
2010-10-23 09:28:24.319441 IP 10.217.31.171.3306 > 10.214.187.15.40422: tcp 64
2010-10-23 09:28:24.319646 IP 10.243.139.111.45401 > 10.217.31.171.3306: tcp 0
2010-10-23 09:28:24.319754 IP 10.194.226.159.35270 > 10.217.31.171.3306: tcp 0
2010-10-23 09:28:24.319762 IP 10.194.226.159.35270 > 10.217.31.171.3306: tcp 0
2010-10-23 09:28:24.319764 IP 10.194.226.159.35270 > 10.217.31.171.3306: tcp 0
2010-10-23 09:28:24.319765 IP 10.194.226.159.35270 > 10.217.31.171.3306: tcp 0
2010-10-23 09:28:24.319856 IP 10.223.43.239.58959 > 10.217.31.171.3306: tcp 105
2010-10-23 09:28:24.320105 IP 10.214.187.15.40422 > 10.217.31.171.3306: tcp 82
2010-10-23 09:28:24.320268 IP 10.217.31.171.3306 > 10.214.187.15.40422: tcp 1448
2010-10-23 09:28:24.320276 IP 10.217.31.171.3306 > 10.214.187.15.40422: tcp 1400
2010-10-23 09:28:24.320433 IP 10.194.226.159.35270 > 10.217.31.171.3306: tcp 177
2010-10-23 09:28:24.320681 IP 10.214.187.15.40422 > 10.217.31.171.3306: tcp 0
2010-10-23 09:28:24.321229 IP 10.214.187.15.40422 > 10.217.31.171.3306: tcp 101
2010-10-23 09:28:24.321313 IP 10.217.31.171.3306 > 10.214.187.15.40422: tcp 889
2010-10-23 09:28:24.321384 IP 10.192.74.63.33649 > 10.217.31.171.3306: tcp 0
2010-10-23 09:28:24.321513 IP 10.217.31.171.3306 > 10.194.226.159.35270: tcp 4344
2010-10-23 09:28:24.321523 IP 10.217.31.171.3306 > 10.194.226.159.35270: tcp 4344
2010-10-23 09:28:24.321529 IP 10.217.31.171.3306 > 10.194.226.159.35270: tcp 2896
2010-10-23 09:28:24.321533 IP 10.217.31.171.3306 > 10.194.226.159.35270: tcp 429
2010-10-23 09:28:24.321672 IP 10.217.31.171.3306 > 10.250.106.79.57880: tcp 1448
2010-10-23 09:28:24.321682 IP 10.217.31.171.3306 > 10.250.106.79.57880: tcp 2896
2010-10-23 09:28:24.321687 IP 10.217.31.171.3306 > 10.250.106.79.57880: tcp 4344
2010-10-23 09:28:24.321691 IP 10.217.31.171.3306 > 10.250.106.79.57880: tcp 1448
2010-10-23 09:28:24.322204 IP 10.214.187.15.40422 > 10.217.31.171.3306: tcp 63
2010-10-23 09:28:24.322329 IP 10.217.31.171.3306 > 10.214.187.15.40422: tcp 1448
2010-10-23 09:28:24.322338 IP 10.217.31.171.3306 > 10.214.187.15.40422: tcp 1448
2010-10-23 09:28:24.322343 IP 10.217.31.171.3306 > 10.214.187.15.40422: tcp 861
2010-10-23 09:28:24.322738 IP 10.250.106.79.57880 > 10.217.31.171.3306: tcp 0
2010-10-23 09:28:24.322763 IP 10.217.31.171.3306 > 10.250.106.79.57880: tcp 1400
2010-10-23 09:28:24.322812 IP 10.214.187.15.40422 > 10.217.31.171.3306: tcp 0
2010-10-23 09:28:24.323259 IP 10.194.226.159.35270 > 10.217.31.171.3306: tcp 0
2010-10-23 09:28:24.323345 IP 10.194.226.159.35270 > 10.217.31.171.3306: tcp 0
2010-10-23 09:28:24.323355 IP 10.194.226.159.35270 > 10.217.31.171.3306: tcp 0
2010-10-23 09:28:24.323357 IP 10.250.106.79.57880 > 10.217.31.171.3306: tcp 0
2010-10-23 09:28:24.323362 IP 10.250.106.79.57880 > 10.217.31.171.3306: tcp 0
2010-10-23 09:28:24.323364 IP 10.194.226.159.35270 > 10.217.31.171.3306: tcp 0
2010-10-23 09:28:24.323527 IP 10.214.187.15.40422 > 10.217.31.171.3306: tcp 110
2010-10-23 09:28:24.323540 IP 10.194.226.159.35270 > 10.217.31.171.3306: tcp 177
2010-10-23 09:28:24.323637 IP 10.250.106.79.57880 > 10.217.31.171.3306: tcp 0
2010-10-23 09:28:24.323646 IP 10.217.31.171.3306 > 10.214.187.15.40422: tcp 64
2010-10-23 09:28:24.324219 IP 10.217.31.171.3306 > 10.223.43.239.58959: tcp 1448
2010-10-23 09:28:24.324230 IP 10.217.31.171.3306 > 10.223.43.239.58959: tcp 4344
2010-10-23 09:28:24.324233 IP 10.217.31.171.3306 > 10.223.43.239.58959: tcp 1448
2010-10-23 09:28:24.324346 IP 10.214.187.15.40422 > 10.217.31.171.3306: tcp 90
2010-10-23 09:28:24.324564 IP 10.217.31.171.3306 > 10.194.226.159.35270: tcp 4344
2010-10-23 09:28:24.324575 IP 10.217.31.171.3306 > 10.194.226.159.35270: tcp 4344
2010-10-23 09:28:24.324582 IP 10.217.31.171.3306 > 10.194.226.159.35270: tcp 2896
2010-10-23 09:28:24.324586 IP 10.217.31.171.3306 > 10.194.226.159.35270: tcp 429
2010-10-23 09:28:24.324735 IP 10.217.31.171.3306 > 10.214.187.15.40422: tcp 790
2010-10-23 09:28:24.325043 IP 10.243.139.111.45401 > 10.217.31.171.3306: tcp 67
2010-10-23 09:28:24.325249 IP 10.217.31.171.3306 > 10.243.139.111.45401: tcp 2896
2010-10-23 09:28:24.325260 IP 10.217.31.171.3306 > 10.243.139.111.45401: tcp 1448
2010-10-23 09:28:24.325372 IP 10.223.43.239.58959 > 10.217.31.171.3306: tcp 0
2010-10-23 09:28:24.325382 IP 10.223.43.239.58959 > 10.217.31.171.3306: tcp 0
2010-10-23 09:28:24.325392 IP 10.217.31.171.3306 > 10.223.43.239.58959: tcp 840
2010-10-23 09:28:24.325434 IP 10.250.106.79.57880 > 10.217.31.171.3306: tcp 126
2010-10-23 09:28:24.325476 IP 10.214.187.15.40422 > 10.217.31.171.3306: tcp 83
2010-10-23 09:28:24.325553 IP 10.217.31.171.3306 > 10.250.106.79.57880: tcp 64
2010-10-23 09:28:24.325579 IP 10.217.31.171.3306 > 10.214.187.15.40422: tcp 64
2010-10-23 09:28:24.326293 IP 10.214.187.15.40422 > 10.217.31.171.3306: tcp 102
2010-10-23 09:28:24.326351 IP 10.194.226.159.35270 > 10.217.31.171.3306: tcp 0
2010-10-23 09:28:24.326415 IP 10.217.31.171.3306 > 10.214.187.15.40422: tcp 64
2010-10-23 09:28:24.326439 IP 10.194.226.159.35270 > 10.217.31.171.3306: tcp 0
2010-10-23 09:28:24.326446 IP 10.194.226.159.35270 > 10.217.31.171.3306: tcp 0
2010-10-23 09:28:24.326448 IP 10.194.226.159.35270 > 10.217.31.171.3306: tcp 0
2010-10-23 09:28:24.326449 IP 10.223.43.239.58959 > 10.217.31.171.3306: tcp 0
2010-10-23 09:28:24.326898 IP 10.243.139.111.45401 > 10.217.31.171.3306: tcp 0
2010-10-23 09:28:24.326913 IP 10.217.31.171.3306 > 10.243.139.111.45401: tcp 1448
2010-10-23 09:28:24.326917 IP 10.217.31.171.3306 > 10.243.139.111.45401: tcp 1321
2010-10-23 09:28:24.327043 IP 10.214.187.15.40422 > 10.217.31.171.3306: tcp 82
2010-10-23 09:28:24.327201 IP 10.217.31.171.3306 > 10.214.187.15.40422: tcp 1448
2010-10-23 09:28:24.327211 IP 10.217.31.171.3306 > 10.214.187.15.40422: tcp 1396
2010-10-23 09:28:24.327594 IP 10.214.187.15.40422 > 10.217.31.171.3306: tcp 0
2010-10-23 09:28:24.327714 IP 10.223.43.239.58959 > 10.217.31.171.3306: tcp 126
2010-10-23 09:28:24.327821 IP 10.217.31.171.3306 > 10.223.43.239.58959: tcp 64
2010-10-23 09:28:24.328124 IP 10.214.187.15.40422 > 10.217.31.171.3306: tcp 83
2010-10-23 09:28:24.328217 IP 10.217.31.171.3306 > 10.214.187.15.40422: tcp 64
2010-10-23 09:28:24.328920 IP 10.214.187.15.40422 > 10.217.31.171.3306: tcp 102
2010-10-23 09:28:24.329032 IP 10.217.31.171.3306 > 10.214.187.15.40422: tcp 64
2010-10-23 09:28:24.329682 IP 10.246.19.127.60912 > 10.217.31.171.3306: tcp 145
2010-10-23 09:28:24.329690 IP 10.214.187.15.40422 > 10.217.31.171.3306: tcp 82
2010-10-23 09:28:24.329823 IP 10.217.31.171.3306 > 10.246.19.127.60912: tcp 601
2010-10-23 09:28:24.329851 IP 10.217.31.171.3306 > 10.214.187.15.40422: tcp 1448
2010-10-23 09:28:24.329858 IP 10.217.31.171.3306 > 10.214.187.15.40422: tcp 1396
2010-10-23 09:28:24.331665 IP 10.246.19.127.60912 > 10.217.31.171.3306: tcp 152
2010-10-23 09:28:24.331769 IP 10.217.31.171.3306 > 10.246.19.127.60912: tcp 601
2010-10-23 09:28:24.332115 IP 10.214.187.15.40422 > 10.217.31.171.3306: tcp 0
2010-10-23 09:28:24.332663 IP 10.214.187.15.40422 > 10.217.31.171.3306: tcp 101
2010-10-23 09:28:24.332744 IP 10.217.31.171.3306 > 10.214.187.15.40422: tcp 889
2010-10-23 09:28:24.333412 IP 10.246.19.127.60912 > 10.217.31.171.3306: tcp 101
2010-10-23 09:28:24.333497 IP 10.217.31.171.3306 > 10.246.19.127.60912: tcp 892
2010-10-23 09:28:24.333602 IP 10.214.187.15.40422 > 10.217.31.171.3306: tcp 63
2010-10-23 09:28:24.333725 IP 10.217.31.171.3306 > 10.214.187.15.40422: tcp 2896
2010-10-23 09:28:24.333735 IP 10.217.31.171.3306 > 10.214.187.15.40422: tcp 1102
2010-10-23 09:28:24.334169 IP 10.214.187.15.40422 > 10.217.31.171.3306: tcp 0
2010-10-23 09:28:24.334974 IP 10.194.226.159.35270 > 10.217.31.171.3306: tcp 254
2010-10-23 09:28:24.335144 IP 10.217.31.171.3306 > 10.194.226.159.35270: tcp 52
2010-10-23 09:28:24.335192 IP 10.246.19.127.60912 > 10.217.31.171.3306: tcp 162
2010-10-23 09:28:24.335299 IP 10.217.31.171.3306 > 10.246.19.127.60912: tcp 601
2010-10-23 09:28:24.335979 IP 10.214.187.15.40422 > 10.217.31.171.3306: tcp 110
2010-10-23 09:28:24.336093 IP 10.217.31.171.3306 > 10.214.187.15.40422: tcp 64
2010-10-23 09:28:24.336378 IP 10.250.94.223.42703 > 10.217.31.171.3306: tcp 5
2010-10-23 09:28:24.336670 IP 10.194.226.159.47787 > 10.217.31.171.3306: tcp 225
2010-10-23 09:28:24.336739 IP 10.214.187.15.40422 > 10.217.31.171.3306: tcp 90
2010-10-23 09:28:24.336770 IP 10.217.31.171.3306 > 10.250.94.223.42703: tcp 162
2010-10-23 09:28:24.336865 IP 10.217.31.171.3306 > 10.214.187.15.40422: tcp 728
2010-10-23 09:28:24.336890 IP 10.246.19.127.60912 > 10.217.31.171.3306: tcp 101
2010-10-23 09:28:24.336934 IP 10.217.31.171.3306 > 10.194.226.159.47787: tcp 19
2010-10-23 09:28:24.337037 IP 10.217.31.171.3306 > 10.246.19.127.60912: tcp 880
2010-10-23 09:28:24.337622 IP 10.214.187.15.40422 > 10.217.31.171.3306: tcp 83
2010-10-23 09:28:24.337676 IP 10.250.94.223.42703 > 10.217.31.171.3306: tcp 0
2010-10-23 09:28:24.337721 IP 10.217.31.171.3306 > 10.214.187.15.40422: tcp 64
2010-10-23 09:28:24.337729 IP 10.194.226.159.35270 > 10.217.31.171.3306: tcp 11
2010-10-23 09:28:24.337824 IP 10.217.31.171.3306 > 10.194.226.159.35270: tcp 11
2010-10-23 09:28:24.337829 IP 10.217.31.171.3306 > 10.211.27.207.42409: tcp 458
2010-10-23 09:28:24.337855 IP 10.217.31.171.3306 > 10.210.193.219.48837: tcp 458
2010-10-23 09:28:24.337886 IP 10.217.31.171.3306 > 10.211.77.139.51107: tcp 458
2010-10-23 09:28:24.337911 IP 10.217.31.171.3306 > 10.218.95.215.59983: tcp 458
2010-10-23 09:28:24.337939 IP 10.217.31.171.3306 > 10.243.90.4.33075: tcp 458
2010-10-23 09:28:24.337966 IP 10.217.31.171.3306 > 10.255.106.95.47590: tcp 458
2010-10-23 09:28:24.338087 IP 10.243.139.111.45401 > 10.217.31.171.3306: tcp 0
2010-10-23 09:28:24.338223 IP 10.211.27.207.42409 > 10.217.31.171.3306: tcp 0
2010-10-23 09:28:24.338317 IP 10.210.193.219.48837 > 10.217.31.171.3306: tcp 0
2010-10-23 09:28:24.338325 IP 10.211.77.139.51107 > 10.217.31.171.3306: tcp 0
2010-10-23 09:28:24.338366 IP 10.255.106.95.47590 > 10.217.31.171.3306: tcp 0
2010-10-23 09:28:24.338450 IP 10.214.187.15.40422 > 10.217.31.171.3306: tcp 102
2010-10-23 09:28:24.338576 IP 10.217.31.171.3306 > 10.214.187.15.40422: tcp 64
2010-10-23 09:28:24.338714 IP 10.246.19.127.60912 > 10.217.31.171.3306: tcp 101
2010-10-23 09:28:24.338798 IP 10.217.31.171.3306 > 10.246.19.127.60912: tcp 878
2010-10-23 09:28:24.339249 IP 10.214.187.15.40422 > 10.217.31.171.3306: tcp 82
2010-10-23 09:28:24.339424 IP 10.217.31.171.3306 > 10.214.187.15.40422: tcp 1448
2010-10-23 09:28:24.339435 IP 10.217.31.171.3306 > 10.214.187.15.40422: tcp 1448
2010-10-23 09:28:24.339439 IP 10.217.31.171.3306 > 10.214.187.15.40422: tcp 293
2010-10-23 09:28:24.339549 IP 10.194.226.159.35270 > 10.217.31.171.3306: tcp 10
2010-10-23 09:28:24.339583 IP 10.217.31.171.3306 > 10.194.226.159.35270: tcp 11
2010-10-23 09:28:24.339713 IP 10.243.90.4.33075 > 10.217.31.171.3306: tcp 0
2010-10-23 09:28:24.339774 IP 10.218.95.215.59983 > 10.217.31.171.3306: tcp 0
2010-10-23 09:28:24.339861 IP 10.214.187.15.40422 > 10.217.31.171.3306: tcp 0
2010-10-23 09:28:24.340297 IP 10.218.95.215.3306 > 10.217.31.171.37559: tcp 436
2010-10-23 09:28:24.340314 IP 10.217.31.171.37559 > 10.218.95.215.3306: tcp 0
2010-10-23 09:28:24.340422 IP 10.246.19.127.60912 > 10.217.31.171.3306: tcp 162
2010-10-23 09:28:24.340468 IP 10.214.187.15.40422 > 10.217.31.171.3306: tcp 101
2010-10-23 09:28:24.340549 IP 10.217.31.171.3306 > 10.246.19.127.60912: tcp 601
2010-10-23 09:28:24.340553 IP 10.217.31.171.3306 > 10.214.187.15.40422: tcp 884
2010-10-23 09:28:24.341393 IP 10.214.187.15.40422 > 10.217.31.171.3306: tcp 63
2010-10-23 09:28:24.341518 IP 10.217.31.171.3306 > 10.214.187.15.40422: tcp 1448
2010-10-23 09:28:24.341529 IP 10.217.31.171.3306 > 10.214.187.15.40422: tcp 1448
2010-10-23 09:28:24.341533 IP 10.217.31.171.3306 > 10.214.187.15.40422: tcp 1051
2010-10-23 09:28:24.341563 IP 10.194.226.159.35270 > 10.217.31.171.3306: tcp 93
2010-10-23 09:28:24.341688 IP 10.217.31.171.3306 > 10.194.226.159.35270: tcp 2896
2010-10-23 09:28:24.341696 IP 10.217.31.171.3306 > 10.194.226.159.35270: tcp 334
2010-10-23 09:28:24.341915 IP 10.214.187.15.40422 > 10.217.31.171.3306: tcp 0
2010-10-23 09:28:24.342015 IP 10.198.15.239.48454 > 10.217.31.171.3306: tcp 0
2010-10-23 09:28:24.342212 IP 10.246.19.127.60912 > 10.217.31.171.3306: tcp 162
2010-10-23 09:28:24.342318 IP 10.217.31.171.3306 > 10.246.19.127.60912: tcp 601
2010-10-23 09:28:24.342391 IP 10.214.187.15.40422 > 10.217.31.171.3306: tcp 110
2010-10-23 09:28:24.342508 IP 10.217.31.171.3306 > 10.214.187.15.40422: tcp 64
2010-10-23 09:28:24.343147 IP 10.214.187.15.40422 > 10.217.31.171.3306: tcp 90
2010-10-23 09:28:24.343261 IP 10.217.31.171.3306 > 10.214.187.15.40422: tcp 782
2010-10-23 09:28:24.343390 IP 10.194.226.159.35270 > 10.217.31.171.3306: tcp 0
2010-10-23 09:28:24.344002 IP 10.214.187.15.40422 > 10.217.31.171.3306: tcp 83
2010-10-23 09:28:24.344092 IP 10.217.31.171.3306 > 10.214.187.15.40422: tcp 64
2010-10-23 09:28:24.344390 IP 10.250.94.223.42703 > 10.217.31.171.3306: tcp 71
2010-10-23 09:28:24.344599 IP 10.217.31.171.3306 > 10.250.94.223.42703: tcp 1448
2010-10-23 09:28:24.344607 IP 10.217.31.171.3306 > 10.250.94.223.42703: tcp 2896
2010-10-23 09:28:24.344824 IP 10.214.187.15.40422 > 10.217.31.171.3306: tcp 102
2010-10-23 09:28:24.344926 IP 10.194.226.159.35270 > 10.217.31.171.3306: tcp 118
2010-10-23 09:28:24.344941 IP 10.217.31.171.3306 > 10.214.187.15.40422: tcp 64
2010-10-23 09:28:24.345062 IP 10.217.31.171.3306 > 10.194.226.159.35270: tcp 52
2010-10-23 09:28:24.345552 IP 10.214.187.15.40422 > 10.217.31.171.3306: tcp 82
2010-10-23 09:28:24.345599 IP 10.250.94.223.42703 > 10.217.31.171.3306: tcp 0
2010-10-23 09:28:24.345615 IP 10.217.31.171.3306 > 10.250.94.223.42703: tcp 1448
2010-10-23 09:28:24.345618 IP 10.217.31.171.3306 > 10.250.94.223.42703: tcp 1325
2010-10-23 09:28:24.345747 IP 10.217.31.171.3306 > 10.214.187.15.40422: tcp 2896
2010-10-23 09:28:24.345755 IP 10.217.31.171.3306 > 10.214.187.15.40422: tcp 287
2010-10-23 09:28:24.346131 IP 10.214.187.15.40422 > 10.217.31.171.3306: tcp 0
2010-10-23 09:28:24.346569 IP 10.250.94.223.42703 > 10.217.31.171.3306: tcp 0
2010-10-23 09:28:24.346881 IP 10.194.226.159.35270 > 10.217.31.171.3306: tcp 11
2010-10-23 09:28:24.346938 IP 10.217.31.171.3306 > 10.211.27.207.42409: tcp 322
2010-10-23 09:28:24.346944 IP 10.217.31.171.3306 > 10.194.226.159.35270: tcp 11
2010-10-23 09:28:24.346960 IP 10.217.31.171.3306 > 10.210.193.219.48837: tcp 322
2010-10-23 09:28:24.346979 IP 10.217.31.171.3306 > 10.211.77.139.51107: tcp 322
2010-10-23 09:28:24.347001 IP 10.217.31.171.3306 > 10.218.95.215.59983: tcp 322
2010-10-23 09:28:24.347021 IP 10.217.31.171.3306 > 10.243.90.4.33075: tcp 322
2010-10-23 09:28:24.347040 IP 10.217.31.171.3306 > 10.255.106.95.47590: tcp 322
2010-10-23 09:28:24.347299 IP 10.211.77.139.51107 > 10.217.31.171.3306: tcp 0
2010-10-23 09:28:24.347348 IP 10.211.27.207.42409 > 10.217.31.171.3306: tcp 0
2010-10-23 09:28:24.347427 IP 10.210.193.219.48837 > 10.217.31.171.3306: tcp 0
2010-10-23 09:28:24.347638 IP 10.250.94.223.42703 > 10.217.31.171.3306: tcp 83
2010-10-23 09:28:24.347778 IP 10.217.31.171.3306 > 10.250.94.223.42703: tcp 1448
2010-10-23 09:28:24.347783 IP 10.217.31.171.3306 > 10.250.94.223.42703: tcp 558
2010-10-23 09:28:24.347884 IP 10.214.187.15.40422 > 10.217.31.171.3306: tcp 83
2010-10-23 09:28:24.347981 IP 10.217.31.171.3306 > 10.214.187.15.40422: tcp 64
2010-10-23 09:28:24.348671 IP 10.194.226.159.35270 > 10.217.31.171.3306: tcp 10
2010-10-23 09:28:24.348704 IP 10.217.31.171.3306 > 10.194.226.159.35270: tcp 11
2010-10-23 09:28:24.348718 IP 10.214.187.15.40422 > 10.217.31.171.3306: tcp 102
2010-10-23 09:28:24.348778 IP 10.218.95.215.59983 > 10.217.31.171.3306: tcp 0
2010-10-23 09:28:24.348829 IP 10.250.94.223.42703 > 10.217.31.171.3306: tcp 0
2010-10-23 09:28:24.348835 IP 10.243.90.4.33075 > 10.217.31.171.3306: tcp 0
2010-10-23 09:28:24.348835 IP 10.217.31.171.3306 > 10.214.187.15.40422: tcp 64
2010-10-23 09:28:24.349208 IP 10.218.95.215.3306 > 10.217.31.171.37559: tcp 300
2010-10-23 09:28:24.349223 IP 10.217.31.171.37559 > 10.218.95.215.3306: tcp 0
2010-10-23 09:28:24.349490 IP 10.214.187.15.40422 > 10.217.31.171.3306: tcp 82
2010-10-23 09:28:24.349536 IP 10.250.94.223.42703 > 10.217.31.171.3306: tcp 59
2010-10-23 09:28:24.349594 IP 10.255.106.95.47590 > 10.217.31.171.3306: tcp 0
2010-10-23 09:28:24.349644 IP 10.217.31.171.3306 > 10.250.94.223.42703: tcp 587
2010-10-23 09:28:24.349658 IP 10.217.31.171.3306 > 10.214.187.15.40422: tcp 1448
2010-10-23 09:28:24.349666 IP 10.217.31.171.3306 > 10.214.187.15.40422: tcp 1448
2010-10-23 09:28:24.349670 IP 10.217.31.171.3306 > 10.214.187.15.40422: tcp 106
2010-10-23 09:28:24.350062 IP 10.214.187.15.40422 > 10.217.31.171.3306: tcp 0
2010-10-23 09:28:24.350672 IP 10.194.226.159.35270 > 10.217.31.171.3306: tcp 93
2010-10-23 09:28:24.350780 IP 10.217.31.171.3306 > 10.194.226.159.35270: tcp 1448
2010-10-23 09:28:24.350790 IP 10.217.31.171.3306 > 10.194.226.159.35270: tcp 1448
2010-10-23 09:28:24.350794 IP 10.217.31.171.3306 > 10.194.226.159.35270: tcp 335
2010-10-23 09:28:24.350811 IP 10.246.19.127.60912 > 10.217.31.171.3306: tcp 111
2010-10-23 09:28:24.351004 IP 10.217.31.171.3306 > 10.246.19.127.60912: tcp 535
2010-10-23 09:28:24.351673 IP 10.214.187.15.40422 > 10.217.31.171.3306: tcp 101
2010-10-23 09:28:24.351760 IP 10.217.31.171.3306 > 10.214.187.15.40422: tcp 879
2010-10-23 09:28:24.352334 IP 10.250.94.223.42703 > 10.217.31.171.3306: tcp 35
2010-10-23 09:28:24.352468 IP 10.194.226.159.35270 > 10.217.31.171.3306: tcp 0
2010-10-23 09:28:24.352603 IP 10.214.187.15.40422 > 10.217.31.171.3306: tcp 63
2010-10-23 09:28:24.352726 IP 10.217.31.171.3306 > 10.214.187.15.40422: tcp 1448
2010-10-23 09:28:24.352734 IP 10.217.31.171.3306 > 10.214.187.15.40422: tcp 1448
2010-10-23 09:28:24.352737 IP 10.217.31.171.3306 > 10.214.187.15.40422: tcp 1228
2010-10-23 09:28:24.352791 IP 10.217.31.171.3306 > 10.250.94.223.42703: tcp 433
2010-10-23 09:28:24.353080 IP 10.194.226.159.35270 > 10.217.31.171.3306: tcp 63
2010-10-23 09:28:24.353162 IP 10.214.187.15.40422 > 10.217.31.171.3306: tcp 0
2010-10-23 09:28:24.353212 IP 10.217.31.171.3306 > 10.194.226.159.35270: tcp 1448
2010-10-23 09:28:24.353222 IP 10.217.31.171.3306 > 10.194.226.159.35270: tcp 1354
2010-10-23 09:28:24.353268 IP 10.252.94.160.43666 > 10.217.31.171.3306: tcp 10
2010-10-23 09:28:24.353312 IP 10.217.31.171.3306 > 10.252.94.160.43666: tcp 11
2010-10-23 09:28:24.353589 IP 10.214.187.15.40422 > 10.217.31.171.3306: tcp 110
2010-10-23 09:28:24.353724 IP 10.217.31.171.3306 > 10.214.187.15.40422: tcp 64
2010-10-23 09:28:24.354233 IP 10.252.94.160.43666 > 10.217.31.171.3306: tcp 0
2010-10-23 09:28:24.354384 IP 10.214.187.15.40422 > 10.217.31.171.3306: tcp 90
2010-10-23 09:28:24.354451 IP 10.250.94.223.42703 > 10.217.31.171.3306: tcp 132
2010-10-23 09:28:24.354497 IP 10.217.31.171.3306 > 10.214.187.15.40422: tcp 788
2010-10-23 09:28:24.354589 IP 10.217.31.171.3306 > 10.250.94.223.42703: tcp 793
2010-10-23 09:28:24.354920 IP 10.194.226.159.35270 > 10.217.31.171.3306: tcp 0
2010-10-23 09:28:24.355246 IP 10.214.187.15.40422 > 10.217.31.171.3306: tcp 83
2010-10-23 09:28:24.355331 IP 10.194.226.159.35270 > 10.217.31.171.3306: tcp 100
2010-10-23 09:28:24.355343 IP 10.217.31.171.3306 > 10.214.187.15.40422: tcp 64
2010-10-23 09:28:24.355425 IP 10.217.31.171.3306 > 10.194.226.159.35270: tcp 887
2010-10-23 09:28:24.355618 IP 10.252.94.160.43666 > 10.217.31.171.3306: tcp 230
2010-10-23 09:28:24.355712 IP 10.217.31.171.3306 > 10.252.94.160.43666: tcp 19
